{
  "schema_version": "1.0.0",
  "league_id": "fl",
  "season_id": "2026",
  "through_matchday": 8,
  "rules": {
    "points_for_win": 3,
    "points_for_draw": 1,
    "yellow_card_ban_threshold": 5,
    "ban_length_matches": 1
  },
  "table": [
    {
      "position": 1,
      "team_id": "cal",
      "played": 8,
      "won": 7,
      "drawn": 1,
      "lost": 0,
      "goals_for": 16,
      "goals_against": 3,
      "goal_difference": 13,
      "points": 22,
      "form": [
        "D",
        "W",
        "W",
        "W",
        "W"
      ]
    },
    {
      "position": 2,
      "team_id": "brk",
      "played": 8,
      "won": 4,
      "drawn": 0,
      "lost": 4,
      "goals_for": 12,
      "goals_against": 17,
      "goal_difference": -5,
      "points": 12,
      "form": [
        "W",
        "L",
        "L",
        "L",
        "W"
      ]
    },
    {
      "position": 3,
      "team_id": "ash",
      "played": 8,
      "won": 2,
      "drawn": 1,
      "lost": 5,
      "goals_for": 7,
      "goals_against": 8,
      "goal_difference": -1,
      "points": 7,
      "form": [
        "L",
        "L",
        "W",
        "W",
        "L"
      ]
    },
    {
      "position": 4,
      "team_id": "els",
      "played": 8,
      "won": 1,
      "drawn": 2,
      "lost": 5,
      "goals_for": 11,
      "goals_against": 18,
      "goal_difference": -7,
      "points": 5,
      "form": [
        "D",
        "W",
        "L",
        "L",
        "L"
      ]
    }
  ],
  "fixtures": [
    {
      "match_id": "m001",
      "matchday": 1,
      "home_id": "ash",
      "away_id": "brk",
      "status": "played",
      "score": {
        "home": 0,
        "away": 1
      }
    },
    {
      "match_id": "m002",
      "matchday": 1,
      "home_id": "cal",
      "away_id": "els",
      "status": "played",
      "score": {
        "home": 3,
        "away": 1
      }
    },
    {
      "match_id": "m003",
      "matchday": 2,
      "home_id": "ash",
      "away_id": "cal",
      "status": "played",
      "score": {
        "home": 0,
        "away": 1
      }
    },
    {
      "match_id": "m004",
      "matchday": 2,
      "home_id": "brk",
      "away_id": "els",
      "status": "played",
      "score": {
        "home": 4,
        "away": 3
      }
    },
    {
      "match_id": "m005",
      "matchday": 3,
      "home_id": "els",
      "away_id": "ash",
      "status": "played",
      "score": {
        "home": 2,
        "away": 2
      }
    },
    {
      "match_id": "m006",
      "matchday": 3,
      "home_id": "brk",
      "away_id": "cal",
      "status": "played",
      "score": {
        "home": 0,
        "away": 2
      }
    },
    {
      "match_id": "m007",
      "matchday": 4,
      "home_id": "brk",
      "away_id": "ash",
      "status": "played",
      "score": {
        "home": 1,
        "away": 0
      }
    },
    {
      "match_id": "m008",
      "matchday": 4,
      "home_id": "els",
      "away_id": "cal",
      "status": "played",
      "score": {
        "home": 0,
        "away": 0
      }
    },
    {
      "match_id": "m009",
      "matchday": 5,
      "home_id": "cal",
      "away_id": "ash",
      "status": "played",
      "score": {
        "home": 2,
        "away": 1
      }
    },
    {
      "match_id": "m010",
      "matchday": 5,
      "home_id": "els",
      "away_id": "brk",
      "status": "played",
      "score": {
        "home": 5,
        "away": 4
      }
    },
    {
      "match_id": "m011",
      "matchday": 6,
      "home_id": "ash",
      "away_id": "els",
      "status": "played",
      "score": {
        "home": 2,
        "away": 0
      }
    },
    {
      "match_id": "m012",
      "matchday": 6,
      "home_id": "cal",
      "away_id": "brk",
      "status": "played",
      "score": {
        "home": 5,
        "away": 1
      }
    },
    {
      "match_id": "m013",
      "matchday": 7,
      "home_id": "ash",
      "away_id": "brk",
      "status": "played",
      "score": {
        "home": 2,
        "away": 0
      }
    },
    {
      "match_id": "m014",
      "matchday": 7,
      "home_id": "cal",
      "away_id": "els",
      "status": "played",
      "score": {
        "home": 2,
        "away": 0
      }
    },
    {
      "match_id": "m015",
      "matchday": 8,
      "home_id": "ash",
      "away_id": "cal",
      "status": "played",
      "score": {
        "home": 0,
        "away": 1
      }
    },
    {
      "match_id": "m016",
      "matchday": 8,
      "home_id": "brk",
      "away_id": "els",
      "status": "played",
      "score": {
        "home": 1,
        "away": 0
      }
    },
    {
      "match_id": "m017",
      "matchday": 9,
      "home_id": "ash",
      "away_id": "brk",
      "status": "live"
    },
    {
      "match_id": "m018",
      "matchday": 9,
      "home_id": "cal",
      "away_id": "els",
      "status": "scheduled"
    },
    {
      "match_id": "m019",
      "matchday": 10,
      "home_id": "cal",
      "away_id": "ash",
      "status": "scheduled"
    },
    {
      "match_id": "m020",
      "matchday": 10,
      "home_id": "els",
      "away_id": "brk",
      "status": "scheduled"
    }
  ],
  "players": [
    {
      "player_id": "ash-01",
      "team_id": "ash",
      "appearances": 8,
      "minutes": 720,
      "goals": 0,
      "assists": 0,
      "shots": 0,
      "passes": 189,
      "pass_accuracy": 0.803,
      "avg_pass_difficulty": 0.362,
      "top_speed_kmh": 33.9,
      "distance_km": 41.6,
      "yellow_cards": 0,
      "red_cards": 0,
      "suspended_for": []
    },
    {
      "player_id": "ash-02",
      "team_id": "ash",
      "appearances": 8,
      "minutes": 720,
      "goals": 0,
      "assists": 0,
      "shots": 1,
      "passes": 380,
      "pass_accuracy": 0.812,
      "avg_pass_difficulty": 0.334,
      "top_speed_kmh": 33.2,
      "distance_km": 84.1,
      "yellow_cards": 1,
      "red_cards": 0,
      "suspended_for": []
    },
    {
      "player_id": "ash-04",
      "team_id": "ash",
      "appearances": 8,
      "minutes": 720,
      "goals": 0,
      "assists": 0,
      "shots": 3,
      "passes": 389,
      "pass_accuracy": 0.825,
      "avg_pass_difficulty": 0.376,
      "top_speed_kmh": 33.1,
      "distance_km": 81.1,
      "yellow_cards": 0,
      "red_cards": 0,
      "suspended_for": []
    },
    {
      "player_id": "ash-05",
      "team_id": "ash",
      "appearances": 8,
      "minutes": 720,
      "goals": 0,
      "assists": 1,
      "shots": 2,
      "passes": 333,
      "pass_accuracy": 0.823,
      "avg_pass_difficulty": 0.396,
      "top_speed_kmh": 33.6,
      "distance_km": 84.4,
      "yellow_cards": 0,
      "red_cards": 0,
      "suspended_for": []
    },
    {
      "player_id": "ash-03",
      "team_id": "ash",
      "appearances": 8,
      "minutes": 720,
      "goals": 0,
      "assists": 3,
      "shots": 3,
      "passes": 315,
      "pass_accuracy": 0.86,
      "avg_pass_difficulty": 0.359,
      "top_speed_kmh": 33.6,
      "distance_km": 83.1,
      "yellow_cards": 4,
      "red_cards": 0,
      "suspended_for": []
    },
    {
      "player_id": "ash-06",
      "team_id": "ash",
      "appearances": 8,
      "minutes": 720,
      "goals": 0,
      "assists": 0,
      "shots": 8,
      "passes": 303,
      "pass_accuracy": 0.84,
      "avg_pass_difficulty": 0.364,
      "top_speed_kmh": 32.6,
      "distance_km": 79.7,
      "yellow_cards": 0,
      "red_cards": 0,
      "suspended_for": []
    },
    {
      "player_id": "ash-08",
      "team_id": "ash",
      "appearances": 8,
      "minutes": 720,
      "goals": 0,
      "assists": 0,
      "shots": 3,
      "passes": 385,
      "pass_accuracy": 0.821,
      "avg_pass_difficulty": 0.364,
      "top_speed_kmh": 34.0,
      "distance_km": 86.3,
      "yellow_cards": 0,
      "red_cards": 0,
      "suspended_for": []
    },
    {
      "player_id": "ash-10",
      "team_id": "ash",
      "appearances": 8,
      "minutes": 720,
      "goals": 1,
      "assists": 0,
      "shots": 11,
      "passes": 331,
      "pass_accuracy": 0.778,
      "avg_pass_difficulty": 0.385,
      "top_speed_kmh": 33.3,
      "distance_km": 83.3,
      "yellow_cards": 0,
      "red_cards": 0,
      "last_goal_matchday": 3,
      "suspended_for": []
    },
    {
      "player_id": "ash-07",
      "team_id": "ash",
      "appearances": 8,
      "minutes": 720,
      "goals": 3,
      "assists": 0,
      "shots": 26,
      "passes": 314,
      "pass_accuracy": 0.821,
      "avg_pass_difficulty": 0.392,
      "top_speed_kmh": 33.9,
      "distance_km": 80.4,
      "yellow_cards": 0,
      "red_cards": 0,
      "last_goal_matchday": 6,
      "suspended_for": []
    },
    {
      "player_id": "ash-09",
      "team_id": "ash",
      "appearances": 8,
      "minutes": 720,
      "goals": 3,
      "assists": 1,
      "shots": 21,
      "passes": 381,
      "pass_accuracy": 0.844,
      "avg_pass_difficulty": 0.363,
      "top_speed_kmh": 34.5,
      "distance_km": 82.4,
      "yellow_cards": 1,
      "red_cards": 0,
      "last_goal_matchday": 7,
      "suspended_for": []
    },
    {
      "player_id": "ash-11",
      "team_id": "ash",
      "appearances": 8,
      "minutes": 720,
      "goals": 0,
      "assists": 0,
      "shots": 17,
      "passes": 283,
      "pass_accuracy": 0.808,
      "avg_pass_difficulty": 0.376,
      "top_speed_kmh": 33.4,
      "distance_km": 79.6,
      "yellow_cards": 3,
      "red_cards": 0,
      "suspended_for": []
    },
    {
      "player_id": "ash-12",
      "team_id": "ash",
      "appearances": 0,
      "minutes": 0,
      "goals": 0,
      "assists": 0,
      "shots": 0,
      "passes": 0,
      "distance_km": 0.0,
      "yellow_cards": 0,
      "red_cards": 0,
      "suspended_for": []
    },
    {
      "player_id": "ash-13",
      "team_id": "ash",
      "appearances": 0,
      "minutes": 0,
      "goals": 0,
      "assists": 0,
      "shots": 0,
      "passes": 0,